{
  "id": "nhl:2026020023",
  "compId": "NHL",
  "season": "2026/27",
  "stage": "regular",
  "round": null,
  "seriesGame": null,
  "utcDate": "2026-10-03T23:00:00Z",
  "status": "LIVE",
  "period": 2,
  "clock": null,
  "finishedIn": null,
  "home": {
    "id": "nhl:tor",
    "score": 0,
    "periods": [],
    "shots": null
  },
  "away": {
    "id": "nhl:ott",
    "score": 1,
    "periods": [],
    "shots": null
  },
  "arena": "Scotiabank Arena",
  "officials": {
    "referees": [],
    "linesmen": []
  },
  "events": [],
  "lineups": null,
  "stats": null,
  "h2h": []
}