{
  "id": "khl:20261003-akb-cska",
  "compId": "KHL",
  "season": "2026/27",
  "stage": "regular",
  "round": 12,
  "utcDate": "2026-10-03T16:00:00Z",
  "status": "FINISHED",
  "period": 3,
  "clock": "20:00",
  "finishedIn": "SO",
  "home": {
    "id": "khl:ak-bars",
    "score": 2,
    "periods": [
      1,
      0,
      0,
      0,
      1
    ],
    "shots": 31
  },
  "away": {
    "id": "khl:cska",
    "score": 1,
    "periods": [
      0,
      1,
      0,
      0,
      0
    ],
    "shots": 33
  },
  "arena": "Татнефть Арена, Казань",
  "officials": {
    "referees": [
      "Виктор Гашилов",
      "Денис Бондарь"
    ],
    "linesmen": [
      "Сергей Шелянин",
      "Никита Вилюгин"
    ]
  },
  "events": [
    {
      "period": 1,
      "time": "09:40",
      "type": "GOAL",
      "team": "home",
      "playerId": "khl:p_semenov",
      "playerName": "Кирилл Семёнов",
      "assists": [
        "khl:p_galiev"
      ],
      "strength": "EV",
      "score": "1:0"
    },
    {
      "period": 2,
      "time": "12:11",
      "type": "GOAL",
      "team": "away",
      "playerId": "khl:p_kamenev",
      "playerName": "Владислав Каменев",
      "assists": [
        "khl:p_okulov"
      ],
      "strength": "EV",
      "score": "1:1"
    },
    {
      "period": "SO",
      "time": "65:00",
      "type": "SHOOTOUT",
      "team": "home",
      "playerId": "khl:p_semenov",
      "playerName": "Кирилл Семёнов",
      "result": "goal"
    }
  ],
  "lineups": {
    "home": {
      "goalies": [
        {
          "playerId": "khl:p_bilialov",
          "name": "Тимур Билялов",
          "number": 82
        }
      ],
      "lines": [
        {
          "LW": "khl:p_galiev",
          "LW_name": "Станислав Галиев",
          "C": "khl:p_semenov",
          "C_name": "Кирилл Семёнов",
          "RW": "khl:p_koshelev",
          "RW_name": "Семён Кошелев",
          "LD": "khl:p_yudin",
          "LD_name": "Дмитрий Юдин",
          "RD": "khl:p_lyamkin",
          "RD_name": "Никита Лямкин"
        }
      ]
    },
    "away": {
      "goalies": [
        {
          "playerId": "khl:p_fedotov",
          "name": "Иван Просветов",
          "number": 30
        }
      ],
      "lines": [
        {
          "LW": "khl:p_okulov",
          "LW_name": "Константин Окулов",
          "C": "khl:p_kamenev",
          "C_name": "Владислав Каменев",
          "RW": "khl:p_mamin",
          "RW_name": "Максим Мамин",
          "LD": "khl:p_nesterov",
          "LD_name": "Никита Нестеров",
          "RD": "khl:p_claesson",
          "RD_name": "Фредрик Классон"
        }
      ]
    }
  },
  "stats": {
    "shots": [
      31,
      33
    ],
    "shotsOnGoal": [
      31,
      33
    ],
    "hits": [
      19,
      21
    ],
    "blocks": [
      15,
      14
    ],
    "faceoffPct": [
      51.0,
      49.0
    ],
    "pim": [
      4,
      6
    ],
    "powerPlay": [
      "0/2",
      "0/2"
    ],
    "takeaways": [
      5,
      4
    ],
    "giveaways": [
      3,
      5
    ]
  },
  "h2h": []
}