{
  "id": "nhl:2026020033",
  "compId": "NHL",
  "season": "2026/27",
  "stage": "regular",
  "round": null,
  "seriesGame": null,
  "utcDate": "2026-10-04T02:00:00Z",
  "status": "SCHEDULED",
  "period": null,
  "clock": null,
  "finishedIn": null,
  "home": {
    "id": "nhl:van",
    "score": null,
    "periods": [],
    "shots": null
  },
  "away": {
    "id": "nhl:cgy",
    "score": null,
    "periods": [],
    "shots": null
  },
  "arena": "Rogers Arena",
  "officials": {
    "referees": [],
    "linesmen": []
  },
  "events": [],
  "lineups": null,
  "stats": null,
  "h2h": []
}