{
  "id": "khl:20261004-avg-mmg",
  "compId": "KHL",
  "season": "2026/27",
  "stage": "regular",
  "round": 13,
  "utcDate": "2026-10-04T13:30:00Z",
  "status": "SCHEDULED",
  "period": null,
  "clock": null,
  "finishedIn": null,
  "home": {
    "id": "khl:avangard",
    "score": null,
    "periods": [],
    "shots": null
  },
  "away": {
    "id": "khl:metallurg-mg",
    "score": null,
    "periods": [],
    "shots": null
  },
  "arena": "G-Drive Арена, Омск",
  "officials": {
    "referees": [
      "Сергей Кулаков",
      "Виктор Бирин"
    ],
    "linesmen": [
      "Максим Строганов",
      "Роман Славиковский"
    ]
  },
  "events": [],
  "lineups": null,
  "stats": null,
  "h2h": []
}