{
  "id": "nhl:2026020042",
  "compId": "NHL",
  "season": "2026/27",
  "stage": "regular",
  "round": null,
  "seriesGame": null,
  "utcDate": "2026-10-05T23:30:00Z",
  "status": "SCHEDULED",
  "period": null,
  "clock": "14:20",
  "finishedIn": null,
  "home": {
    "id": "nhl:pit",
    "score": null,
    "periods": [],
    "shots": 30
  },
  "away": {
    "id": "nhl:wpg",
    "score": null,
    "periods": [],
    "shots": 28
  },
  "arena": "PPG Paints Arena",
  "officials": {
    "referees": [
      "Chris Rooney",
      "Kelly Sutherland"
    ],
    "linesmen": [
      "Matt MacPherson",
      "Ryan Daisy"
    ]
  },
  "events": [],
  "lineups": {
    "home": {
      "goalies": [
        {
          "playerId": "nhl:g_pit",
          "name": "Вратарь 1",
          "number": 31
        }
      ],
      "lines": [
        {
          "LW": "nhl:f1_pit",
          "LW_name": "Нападающий 1",
          "C": "nhl:c1_pit",
          "C_name": "Центр 1",
          "RW": "nhl:f2_pit",
          "RW_name": "Нападающий 2",
          "LD": "nhl:d1_pit",
          "LD_name": "Защитник 1",
          "RD": "nhl:d2_pit",
          "RD_name": "Защитник 2"
        }
      ]
    },
    "away": {
      "goalies": [
        {
          "playerId": "nhl:g_wpg",
          "name": "Вратарь 1",
          "number": 35
        }
      ],
      "lines": [
        {
          "LW": "nhl:f1_wpg",
          "LW_name": "Нападающий 1",
          "C": "nhl:c1_wpg",
          "C_name": "Центр 1",
          "RW": "nhl:f2_wpg",
          "RW_name": "Нападающий 2",
          "LD": "nhl:d1_wpg",
          "LD_name": "Защитник 1",
          "RD": "nhl:d2_wpg",
          "RD_name": "Защитник 2"
        }
      ]
    }
  },
  "stats": {
    "shots": [
      32,
      29
    ],
    "shotsOnGoal": [
      30,
      28
    ],
    "hits": [
      22,
      19
    ],
    "blocks": [
      14,
      11
    ],
    "faceoffPct": [
      53.5,
      46.5
    ],
    "pim": [
      6,
      8
    ],
    "powerPlay": [
      "1/3",
      "0/2"
    ],
    "takeaways": [
      6,
      4
    ],
    "giveaways": [
      5,
      7
    ]
  },
  "h2h": []
}